{
  "$ref": "#/definitions/RunReceipt",
  "$schema": "http://json-schema.org/draft-07/schema#",
  "definitions": {
    "RunReceipt": {
      "additionalProperties": false,
      "properties": {
        "attempt": {
          "exclusiveMinimum": 0,
          "type": "integer"
        },
        "changedFiles": {
          "items": {
            "type": "string"
          },
          "type": "array"
        },
        "dispatchId": {
          "format": "uuid",
          "type": "string"
        },
        "endedAt": {
          "pattern": "^\\d{4}-\\d{2}-\\d{2}T\\d{2}:\\d{2}:\\d{2}(?:\\.\\d+)?Z$",
          "type": "string"
        },
        "evidence": {
          "items": {
            "additionalProperties": false,
            "properties": {
              "artifactId": {
                "format": "uuid",
                "type": "string"
              },
              "contentHash": {
                "type": [
                  "string",
                  "null"
                ]
              },
              "kind": {
                "enum": [
                  "spec",
                  "ticket",
                  "story",
                  "review",
                  "adr",
                  "other"
                ],
                "type": "string"
              },
              "ownerId": {
                "minLength": 1,
                "type": "string"
              },
              "ownerKind": {
                "enum": [
                  "project",
                  "epic",
                  "task",
                  "dispatch"
                ],
                "type": "string"
              },
              "promotedPath": {
                "type": [
                  "string",
                  "null"
                ]
              },
              "uri": {
                "minLength": 1,
                "type": "string"
              },
              "version": {
                "type": [
                  "string",
                  "null"
                ]
              }
            },
            "required": [
              "artifactId",
              "ownerKind",
              "ownerId",
              "uri",
              "kind",
              "version",
              "contentHash",
              "promotedPath"
            ],
            "type": "object"
          },
          "type": "array"
        },
        "failure": {
          "anyOf": [
            {
              "additionalProperties": false,
              "properties": {
                "category": {
                  "enum": [
                    "executor-error",
                    "timeout",
                    "policy-violation",
                    "context-mismatch",
                    "cancelled-by-operator",
                    "unknown"
                  ],
                  "type": "string"
                },
                "message": {
                  "minLength": 1,
                  "type": "string"
                },
                "retryable": {
                  "type": "boolean"
                }
              },
              "required": [
                "category",
                "message",
                "retryable"
              ],
              "type": "object"
            },
            {
              "type": "null"
            }
          ]
        },
        "historySource": {
          "enum": [
            "codex",
            "opencode",
            "claude-code",
            "git",
            "mixed"
          ],
          "type": "string"
        },
        "historyTier": {
          "enum": [
            "measured",
            "inferred",
            "declared",
            "no-history"
          ],
          "type": "string"
        },
        "outcome": {
          "enum": [
            "completed",
            "failed",
            "blocked",
            "cancelled"
          ],
          "type": "string"
        },
        "schemaVersion": {
          "exclusiveMinimum": 0,
          "type": "integer"
        },
        "startedAt": {
          "pattern": "^\\d{4}-\\d{2}-\\d{2}T\\d{2}:\\d{2}:\\d{2}(?:\\.\\d+)?Z$",
          "type": "string"
        },
        "timeEvidence": {
          "additionalProperties": false,
          "properties": {
            "intervals": {
              "items": {
                "additionalProperties": false,
                "properties": {
                  "confidence": {
                    "enum": [
                      "inferred",
                      "corroborated"
                    ],
                    "type": "string"
                  },
                  "end": {
                    "pattern": "^\\d{4}-\\d{2}-\\d{2}T\\d{2}:\\d{2}:\\d{2}(?:\\.\\d+)?Z$",
                    "type": "string"
                  },
                  "kind": {
                    "enum": [
                      "active",
                      "review",
                      "human",
                      "parked"
                    ],
                    "type": "string"
                  },
                  "owner": {
                    "enum": [
                      "agent",
                      "human"
                    ],
                    "type": "string"
                  },
                  "sessionId": {
                    "minLength": 1,
                    "type": "string"
                  },
                  "start": {
                    "pattern": "^\\d{4}-\\d{2}-\\d{2}T\\d{2}:\\d{2}:\\d{2}(?:\\.\\d+)?Z$",
                    "type": "string"
                  }
                },
                "required": [
                  "start",
                  "end",
                  "owner",
                  "kind"
                ],
                "type": "object"
              },
              "type": "array"
            },
            "policy": {
              "additionalProperties": false,
              "properties": {
                "idleThresholdMs": {
                  "exclusiveMinimum": 0,
                  "type": "integer"
                },
                "parkedThresholdMs": {
                  "exclusiveMinimum": 0,
                  "type": "integer"
                },
                "reviewThresholdMs": {
                  "exclusiveMinimum": 0,
                  "type": "integer"
                },
                "timeZone": {
                  "minLength": 1,
                  "type": "string"
                }
              },
              "required": [
                "idleThresholdMs",
                "reviewThresholdMs",
                "parkedThresholdMs",
                "timeZone"
              ],
              "type": "object"
            },
            "schemaVersion": {
              "const": 1,
              "type": "number"
            },
            "sessionSpans": {
              "items": {
                "additionalProperties": false,
                "properties": {
                  "end": {
                    "pattern": "^\\d{4}-\\d{2}-\\d{2}T\\d{2}:\\d{2}:\\d{2}(?:\\.\\d+)?Z$",
                    "type": "string"
                  },
                  "sessionId": {
                    "minLength": 1,
                    "type": "string"
                  },
                  "start": {
                    "pattern": "^\\d{4}-\\d{2}-\\d{2}T\\d{2}:\\d{2}:\\d{2}(?:\\.\\d+)?Z$",
                    "type": "string"
                  }
                },
                "required": [
                  "start",
                  "end",
                  "sessionId"
                ],
                "type": "object"
              },
              "type": "array"
            },
            "source": {
              "enum": [
                "claude-jsonl",
                "codex-jsonl",
                "opencode-db"
              ],
              "type": "string"
            }
          },
          "required": [
            "schemaVersion",
            "source",
            "policy",
            "intervals"
          ],
          "type": "object"
        },
        "usageEvents": {
          "items": {
            "additionalProperties": false,
            "properties": {
              "cacheTokens": {
                "minimum": 0,
                "type": "integer"
              },
              "coverage": {
                "enum": [
                  "full",
                  "partial",
                  "none"
                ],
                "type": "string"
              },
              "dispatchId": {
                "format": "uuid",
                "type": "string"
              },
              "inputTokens": {
                "minimum": 0,
                "type": "integer"
              },
              "model": {
                "minLength": 1,
                "type": "string"
              },
              "outputTokens": {
                "minimum": 0,
                "type": "integer"
              },
              "provider": {
                "minLength": 1,
                "type": "string"
              },
              "source": {
                "enum": [
                  "harness-transcript",
                  "provider-api",
                  "manual",
                  "absent"
                ],
                "type": "string"
              },
              "usageEventId": {
                "format": "uuid",
                "type": "string"
              }
            },
            "required": [
              "usageEventId",
              "dispatchId",
              "provider",
              "model",
              "inputTokens",
              "cacheTokens",
              "outputTokens",
              "source",
              "coverage"
            ],
            "type": "object"
          },
          "type": "array"
        }
      },
      "required": [
        "schemaVersion",
        "dispatchId",
        "attempt",
        "outcome",
        "startedAt",
        "endedAt",
        "changedFiles",
        "usageEvents",
        "evidence",
        "failure"
      ],
      "type": "object"
    }
  }
}
